question_text,statement_1,statement_2,options,explanation,metadata,difficulty_level,difficulty_rating,estimated_time
"What is the product of two decimal numbers, A and B?",A = 0.5 and B = 0.3,A * B = 0.15,"[{""text"": ""Statement (1) ALONE is sufficient, but statement (2) alone is not sufficient."", ""correct"": false}, {""text"": ""Statement (2) ALONE is sufficient, but statement (1) alone is not sufficient."", ""correct"": true}, {""text"": ""BOTH statements TOGETHER are sufficient, but NEITHER statement ALONE is sufficient."", ""correct"": false}, {""text"": ""EACH statement ALONE is sufficient."", ""correct"": false}, {""text"": ""Statements (1) and (2) TOGETHER are NOT sufficient."", ""correct"": false}]","Statement (2) gives the product directly, hence it is sufficient to determine the product of A and B. Statement (1) provides values for A and B, but we still need to multiply them to find the product, making it insufficient alone.","{""section"": ""Data Insights"", ""subsection"": ""Data Sufficiency"", ""topic"": ""Arithmetic DS"", ""subtopic"": ""Decimals (DS)""}",Medium,3.0,120
"Is the sum of two decimal numbers, X and Y, greater than 1?",X = 0.65 and Y = 0.35,X + Y = 1.05,"[{""text"": ""Statement (1) ALONE is sufficient, but statement (2) alone is not sufficient."", ""correct"": false}, {""text"": ""Statement (2) ALONE is sufficient, but statement (1) alone is not sufficient."", ""correct"": true}, {""text"": ""BOTH statements TOGETHER are sufficient, but NEITHER statement ALONE is sufficient."", ""correct"": false}, {""text"": ""EACH statement ALONE is sufficient."", ""correct"": false}, {""text"": ""Statements (1) and (2) TOGETHER are NOT sufficient."", ""correct"": false}]","Statement (2) indicates that the sum of X and Y is 1.05, which is greater than 1. Thus, it is sufficient. Statement (1) confirms the sum but does not directly answer the question without additional calculation.","{""section"": ""Data Insights"", ""subsection"": ""Data Sufficiency"", ""topic"": ""Arithmetic DS"", ""subtopic"": ""Decimals (DS)""}",Medium,3.5,150
"What is the difference between two decimal numbers, M and N?",M + N = 2.4,M - N = 0.6,"[{""text"": ""Statement (1) ALONE is sufficient, but statement (2) alone is not sufficient."", ""correct"": false}, {""text"": ""Statement (2) ALONE is sufficient, but statement (1) alone is not sufficient."", ""correct"": false}, {""text"": ""BOTH statements TOGETHER are sufficient, but NEITHER statement ALONE is sufficient."", ""correct"": true}, {""text"": ""EACH statement ALONE is sufficient."", ""correct"": false}, {""text"": ""Statements (1) and (2) TOGETHER are NOT sufficient."", ""correct"": false}]","Combining the equations from both statements allows us to solve for M and N. From M + N = 2.4 and M - N = 0.6, we can determine the values of M and N, thus finding their difference.","{""section"": ""Data Insights"", ""subsection"": ""Data Sufficiency"", ""topic"": ""Arithmetic DS"", ""subtopic"": ""Decimals (DS)""}",Hard,4.0,180
What is the value of the fraction a/b if a is 3 times b?,a = 3b.,b = 2.,"[{""text"": ""Statement (1) ALONE is sufficient, but statement (2) alone is not sufficient."", ""correct"": true}, {""text"": ""Statement (2) ALONE is sufficient, but statement (1) alone is not sufficient."", ""correct"": false}, {""text"": ""BOTH statements TOGETHER are sufficient, but NEITHER statement ALONE is sufficient."", ""correct"": false}, {""text"": ""EACH statement ALONE is sufficient."", ""correct"": false}, {""text"": ""Statements (1) and (2) TOGETHER are NOT sufficient."", ""correct"": false}]","Statement (1) directly gives the ratio of a to b, allowing us to compute a/b = 3. Statement (2) alone does not provide enough information about a.","{""section"": ""Data Insights"", ""subsection"": ""Data Sufficiency"", ""topic"": ""Arithmetic DS"", ""subtopic"": ""Fractions (DS)""}",Easy,2.5,60
Is the fraction x/y greater than 1/2?,x > y.,x + y = 5.,"[{""text"": ""Statement (1) ALONE is sufficient, but statement (2) alone is not sufficient."", ""correct"": false}, {""text"": ""Statement (2) ALONE is sufficient, but statement (1) alone is not sufficient."", ""correct"": false}, {""text"": ""BOTH statements TOGETHER are sufficient, but NEITHER statement ALONE is sufficient."", ""correct"": true}, {""text"": ""EACH statement ALONE is sufficient."", ""correct"": false}, {""text"": ""Statements (1) and (2) TOGETHER are NOT sufficient."", ""correct"": false}]","From Statement (1), knowing x > y does not guarantee x/y > 1/2. From Statement (2), x + y = 5 allows us to express y as 5 - x. Combining both statements, we can determine the inequality x > (5 - x)/2, which can be solved to show that x/y can be greater than 1/2.","{""section"": ""Data Insights"", ""subsection"": ""Data Sufficiency"", ""topic"": ""Arithmetic DS"", ""subtopic"": ""Fractions (DS)""}",Medium,3.5,120
What is the value of the fraction p/q?,p + q = 12 and p/q = 3/4.,p - q = 4.,"[{""text"": ""Statement (1) ALONE is sufficient, but statement (2) alone is not sufficient."", ""correct"": false}, {""text"": ""Statement (2) ALONE is sufficient, but statement (1) alone is not sufficient."", ""correct"": false}, {""text"": ""BOTH statements TOGETHER are sufficient, but NEITHER statement ALONE is sufficient."", ""correct"": true}, {""text"": ""EACH statement ALONE is sufficient."", ""correct"": false}, {""text"": ""Statements (1) and (2) TOGETHER are NOT sufficient."", ""correct"": false}]","Statement (1) gives a direct ratio for p/q, but not the individual values. Statement (2) can be combined with Statement (1) to find exact values for p and q. Therefore, both statements together allow us to determine the value of the fraction.","{""section"": ""Data Insights"", ""subsection"": ""Data Sufficiency"", ""topic"": ""Arithmetic DS"", ""subtopic"": ""Fractions (DS)""}",Hard,4.5,180
What is the value of x if x is a fraction?,x is greater than 1/2.,x is less than 3/4.,"[{""text"": ""Statement (1) ALONE is sufficient, but statement (2) alone is not sufficient."", ""correct"": false}, {""text"": ""Statement (2) ALONE is sufficient, but statement (1) alone is not sufficient."", ""correct"": false}, {""text"": ""BOTH statements TOGETHER are sufficient, but NEITHER statement ALONE is sufficient."", ""correct"": true}, {""text"": ""EACH statement ALONE is sufficient."", ""correct"": false}, {""text"": ""Statements (1) and (2) TOGETHER are NOT sufficient."", ""correct"": false}]","Using Statement 1, we know x is greater than 1/2, and from Statement 2, we know it is less than 3/4. Together, they provide a range for x (1/2 < x < 3/4), confirming that both statements are necessary to establish the value of x.","{""section"": ""Data Insights"", ""subsection"": ""Data Sufficiency"", ""topic"": ""Arithmetic DS"", ""subtopic"": ""Fractions (DS)""}",Medium,3.5,120
What is the value of x if x is a fraction between 0 and 1?,x is equal to 2/5.,x is less than 3/4.,"[{""text"": ""Statement (1) ALONE is sufficient, but statement (2) alone is not sufficient."", ""correct"": false}, {""text"": ""Statement (2) ALONE is sufficient, but statement (1) alone is not sufficient."", ""correct"": false}, {""text"": ""BOTH statements TOGETHER are sufficient, but NEITHER statement ALONE is sufficient."", ""correct"": true}, {""text"": ""EACH statement ALONE is sufficient."", ""correct"": false}, {""text"": ""Statements (1) and (2) TOGETHER are NOT sufficient."", ""correct"": false}]","Statement (1) gives a specific value for x, while statement (2 tells us that x is less than 3/4. Together, they confirm that x must be between 0 and 1 and specifically equal to 2/5.","{""section"": ""Data Insights"", ""subsection"": ""Data Sufficiency"", ""topic"": ""Arithmetic DS"", ""subtopic"": ""Fractions (DS)""}",Medium,3.5,120
"If a fraction is represented as a/b, what is its value?",a = 3b.,b = 4.,"[{""text"": ""Statement (1) ALONE is sufficient, but statement (2) alone is not sufficient."", ""correct"": false}, {""text"": ""Statement (2) ALONE is sufficient, but statement (1) alone is not sufficient."", ""correct"": false}, {""text"": ""BOTH statements TOGETHER are sufficient, but NEITHER statement ALONE is sufficient."", ""correct"": true}, {""text"": ""EACH statement ALONE is sufficient."", ""correct"": false}, {""text"": ""Statements (1) and (2) TOGETHER are NOT sufficient."", ""correct"": false}]","Statement (1) provides a relationship between a and b, while statement (2) gives a specific value for b. Together, they allow us to find the value of the fraction.","{""section"": ""Data Insights"", ""subsection"": ""Data Sufficiency"", ""topic"": ""Arithmetic DS"", ""subtopic"": ""Fractions (DS)""}",Medium,3.5,120
What is the value of the fraction x/y?,x = 5 and y = 2.,x + y = 8.,"[{""text"": ""Statement (1) ALONE is sufficient, but statement (2) alone is not sufficient."", ""correct"": true}, {""text"": ""Statement (2) ALONE is sufficient, but statement (1) alone is not sufficient."", ""correct"": false}, {""text"": ""BOTH statements TOGETHER are sufficient, but NEITHER statement ALONE is sufficient."", ""correct"": false}, {""text"": ""EACH statement ALONE is sufficient."", ""correct"": false}, {""text"": ""Statements (1) and (2) TOGETHER are NOT sufficient."", ""correct"": false}]","Statement (1) gives the specific values of x and y, allowing us to calculate the fraction. Statement (2) alone does not provide specific values for x and y.","{""section"": ""Data Insights"", ""subsection"": ""Data Sufficiency"", ""topic"": ""Arithmetic DS"", ""subtopic"": ""Fractions (DS)""}",Hard,4.0,180
What is the value of the fraction \( \frac{a}{b} \) if \( a \) is a certain number and \( b \) is twice that number?,The value of \( a \) is 6.,The value of \( b \) is 12.,"[{""text"": ""Statement (1) ALONE is sufficient, but statement (2) alone is not sufficient."", ""correct"": true}, {""text"": ""Statement (2) ALONE is sufficient, but statement (1) alone is not sufficient."", ""correct"": false}, {""text"": ""BOTH statements TOGETHER are sufficient, but NEITHER statement ALONE is sufficient."", ""correct"": false}, {""text"": ""EACH statement ALONE is sufficient."", ""correct"": false}, {""text"": ""Statements (1) and (2) TOGETHER are NOT sufficient."", ""correct"": false}]","From Statement 1, if \( a = 6 \), then \( b = 2a = 12 \), which gives \( \frac{a}{b} = \frac{6}{12} = \frac{1}{2} \). Statement 2 alone gives \( b = 12 \) but does not provide any value for \( a \), making it insufficient by itself.","{""section"": ""Data Insights"", ""subsection"": ""Data Sufficiency"", ""topic"": ""Arithmetic DS"", ""subtopic"": ""Fractions (DS)""}",Medium,3.5,120
What is the value of x if 0.5x = 2.5?,x is a positive integer.,x is a decimal number less than 10.,"[{""text"": ""Statement (1) ALONE is sufficient, but statement (2) alone is not sufficient."", ""correct"": false}, {""text"": ""Statement (2) ALONE is sufficient, but statement (1) alone is not sufficient."", ""correct"": false}, {""text"": ""BOTH statements TOGETHER are sufficient, but NEITHER statement ALONE is sufficient."", ""correct"": true}, {""text"": ""EACH statement ALONE is sufficient."", ""correct"": false}, {""text"": ""Statements (1) and (2) TOGETHER are NOT sufficient."", ""correct"": false}]","From statement (1), we know x is a positive integer. Solving 0.5x = 2.5 gives x = 5, which is a positive integer. Statement (2) tells us that x is a decimal number less than 10, but does not provide a unique value. Together, they confirm that x = 5.","{""section"": ""Data Insights"", ""subsection"": ""Data Sufficiency"", ""topic"": ""Arithmetic DS"", ""subtopic"": ""Decimals (DS)""}",Easy,2.5,75
Is the decimal representation of A greater than 0.75?,A = 0.8 + 0.3.,A = 1.1 - 0.4.,"[{""text"": ""Statement (1) ALONE is sufficient, but statement (2) alone is not sufficient."", ""correct"": false}, {""text"": ""Statement (2) ALONE is sufficient, but statement (1) alone is not sufficient."", ""correct"": false}, {""text"": ""BOTH statements TOGETHER are sufficient, but NEITHER statement ALONE is sufficient."", ""correct"": true}, {""text"": ""EACH statement ALONE is sufficient."", ""correct"": false}, {""text"": ""Statements (1) and (2) TOGETHER are NOT sufficient."", ""correct"": false}]","From statement (1), A = 1.1, which is greater than 0.75. From statement (2), A = 0.7, which is not greater than 0.75. Both statements together confirm that A can take different values, but alone they do not provide a singular answer.","{""section"": ""Data Insights"", ""subsection"": ""Data Sufficiency"", ""topic"": ""Arithmetic DS"", ""subtopic"": ""Decimals (DS)""}",Medium,3.0,120
What is the product of decimals A and B if A + B = 1.6?,A = 0.4 and B = 1.2.,A = 0.5 and B = 1.1.,"[{""text"": ""Statement (1) ALONE is sufficient, but statement (2) alone is not sufficient."", ""correct"": true}, {""text"": ""Statement (2) ALONE is sufficient, but statement (1) alone is not sufficient."", ""correct"": false}, {""text"": ""BOTH statements TOGETHER are sufficient, but NEITHER statement ALONE is sufficient."", ""correct"": false}, {""text"": ""EACH statement ALONE is sufficient."", ""correct"": false}, {""text"": ""Statements (1) and (2) TOGETHER are NOT sufficient."", ""correct"": false}]","From statement (1), A = 0.4 and B = 1.2 gives a product of 0.48. From statement (2), A = 0.5 and B = 1.1 gives a product of 0.55. Only statement (1) provides a specific answer to the product.","{""section"": ""Data Insights"", ""subsection"": ""Data Sufficiency"", ""topic"": ""Arithmetic DS"", ""subtopic"": ""Decimals (DS)""}",Hard,4.0,180
What is the value of x if x is a decimal number?,x is greater than 0.5.,x is less than 1.2.,"[{""text"": ""Statement (1) ALONE is sufficient, but statement (2) alone is not sufficient."", ""correct"": false}, {""text"": ""Statement (2) ALONE is sufficient, but statement (1) alone is not sufficient."", ""correct"": false}, {""text"": ""BOTH statements TOGETHER are sufficient, but NEITHER statement ALONE is sufficient."", ""correct"": true}, {""text"": ""EACH statement ALONE is sufficient."", ""correct"": false}, {""text"": ""Statements (1) and (2) TOGETHER are NOT sufficient."", ""correct"": false}]","Statement (1) indicates that x is greater than 0.5, and statement (2) indicates that x is less than 1.2. Together, these statements imply that x is in the range (0.5, 1.2), which does not uniquely define x, but provides bounds that make both statements necessary for understanding the range of possible values for x.","{""section"": ""Data Insights"", ""subsection"": ""Data Sufficiency"", ""topic"": ""Arithmetic DS"", ""subtopic"": ""Decimals (DS)""}",Medium,3.5,120
What is the value of x if x is a fraction between 0 and 1?,x is greater than 1/4.,x is less than 3/4.,"[{""text"": ""Statement (1) ALONE is sufficient, but statement (2) alone is not sufficient."", ""correct"": false}, {""text"": ""Statement (2) ALONE is sufficient, but statement (1) alone is not sufficient."", ""correct"": false}, {""text"": ""BOTH statements TOGETHER are sufficient, but NEITHER statement ALONE is sufficient."", ""correct"": true}, {""text"": ""EACH statement ALONE is sufficient."", ""correct"": false}, {""text"": ""Statements (1) and (2) TOGETHER are NOT sufficient."", ""correct"": false}]","Combining both statements gives us the range 1/4 < x < 3/4. This range indicates that x can take on values within these limits, but does not uniquely define x. Therefore, both statements together are necessary to find a range for x, but they do not provide a specific value.","{""section"": ""Data Insights"", ""subsection"": ""Data Sufficiency"", ""topic"": ""Arithmetic DS"", ""subtopic"": ""Fractions (DS)""}",Medium,3.0,120
"If x and y are two fractions, is x + y greater than 1?",x = 1/2.,y = 1/3.,"[{""text"": ""Statement (1) ALONE is sufficient, but statement (2) alone is not sufficient."", ""correct"": false}, {""text"": ""Statement (2) ALONE is sufficient, but statement (1) alone is not sufficient."", ""correct"": false}, {""text"": ""BOTH statements TOGETHER are sufficient, but NEITHER statement ALONE is sufficient."", ""correct"": true}, {""text"": ""EACH statement ALONE is sufficient."", ""correct"": false}, {""text"": ""Statements (1) and (2) TOGETHER are NOT sufficient."", ""correct"": false}]","From Statement 1, we know x = 1/2. From Statement 2, y = 1/3, so x + y = 1/2 + 1/3 = 3/6 + 2/6 = 5/6, which is less than 1. Thus, both statements together provide sufficient information to answer the question.","{""section"": ""Data Insights"", ""subsection"": ""Data Sufficiency"", ""topic"": ""Arithmetic DS"", ""subtopic"": ""Fractions (DS)""}",Medium,3.5,150
What is the product of the fractions a and b?,a = 2/5 and b = 3/4.,a + b = 1/2.,"[{""text"": ""Statement (1) ALONE is sufficient, but statement (2) alone is not sufficient."", ""correct"": true}, {""text"": ""Statement (2) ALONE is sufficient, but statement (1) alone is not sufficient."", ""correct"": false}, {""text"": ""BOTH statements TOGETHER are sufficient, but NEITHER statement ALONE is sufficient."", ""correct"": false}, {""text"": ""EACH statement ALONE is sufficient."", ""correct"": false}, {""text"": ""Statements (1) and (2) TOGETHER are NOT sufficient."", ""correct"": false}]","Statement 1 provides the values of a and b directly, allowing us to calculate the product (2/5) * (3/4) = 6/20 = 3/10. Statement 2 alone does not provide sufficient information to determine the exact values of a and b, thus it cannot be used to find the product.","{""section"": ""Data Insights"", ""subsection"": ""Data Sufficiency"", ""topic"": ""Arithmetic DS"", ""subtopic"": ""Fractions (DS)""}",Hard,4.0,180
What is the value of x if x is a fraction?,x = 3/4 + 1/2,x = 1/4 of 12,"[{""text"": ""Statement (1) ALONE is sufficient, but statement (2) alone is not sufficient."", ""correct"": false}, {""text"": ""Statement (2) ALONE is sufficient, but statement (1) alone is not sufficient."", ""correct"": false}, {""text"": ""BOTH statements TOGETHER are sufficient, but NEITHER statement ALONE is sufficient."", ""correct"": true}, {""text"": ""EACH statement ALONE is sufficient."", ""correct"": false}, {""text"": ""Statements (1) and (2) TOGETHER are NOT sufficient."", ""correct"": false}]","Statement (1) gives x = 3/4 + 1/2 = 3/4 + 2/4 = 5/4. Statement (2) gives x = 1/4 * 12 = 3. Therefore, both statements give different values for x, but together they confirm a specific range for x.","{""section"": ""Data Insights"", ""subsection"": ""Data Sufficiency"", ""topic"": ""Arithmetic DS"", ""subtopic"": ""Fractions (DS)""}",Medium,3.5,120
What is the decimal representation of a certain fraction if the fraction is given as 5/8?,The decimal representation of 5/8 can be calculated as a simple division.,5 divided by 8 equals 0.625.,"[{""text"": ""Statement (1) ALONE is sufficient, but statement (2) alone is not sufficient."", ""correct"": false}, {""text"": ""Statement (2) ALONE is sufficient, but statement (1) alone is not sufficient."", ""correct"": true}, {""text"": ""BOTH statements TOGETHER are sufficient, but NEITHER statement ALONE is sufficient."", ""correct"": false}, {""text"": ""EACH statement ALONE is sufficient."", ""correct"": false}, {""text"": ""Statements (1) and (2) TOGETHER are NOT sufficient."", ""correct"": false}]","Statement (2) directly provides the decimal representation of the fraction 5/8, making it sufficient. Statement (1) describes how to find the decimal but does not provide the answer itself.","{""section"": ""Data Insights"", ""subsection"": ""Data Sufficiency"", ""topic"": ""Arithmetic DS"", ""subtopic"": ""Decimals (DS)""}",Easy,2.0,60
"If x is a decimal number, what is the value of 3x?",x = 0.4.,x = 2.5.,"[{""text"": ""Statement (1) ALONE is sufficient, but statement (2) alone is not sufficient."", ""correct"": true}, {""text"": ""Statement (2) ALONE is sufficient, but statement (1) alone is not sufficient."", ""correct"": true}, {""text"": ""BOTH statements TOGETHER are sufficient, but NEITHER statement ALONE is sufficient."", ""correct"": false}, {""text"": ""EACH statement ALONE is sufficient."", ""correct"": true}, {""text"": ""Statements (1) and (2) TOGETHER are NOT sufficient."", ""correct"": false}]","Both statements provide specific values for x. Thus, both statements can independently be used to find the value of 3x.","{""section"": ""Data Insights"", ""subsection"": ""Data Sufficiency"", ""topic"": ""Arithmetic DS"", ""subtopic"": ""Decimals (DS)""}",Medium,3.5,120
What is the total of two decimal numbers x and y?,x is 1.25 and y is 2.75.,The sum of x and y is less than 5.,"[{""text"": ""Statement (1) ALONE is sufficient, but statement (2) alone is not sufficient."", ""correct"": true}, {""text"": ""Statement (2) ALONE is sufficient, but statement (1) alone is not sufficient."", ""correct"": false}, {""text"": ""BOTH statements TOGETHER are sufficient, but NEITHER statement ALONE is sufficient."", ""correct"": false}, {""text"": ""EACH statement ALONE is sufficient."", ""correct"": false}, {""text"": ""Statements (1) and (2) TOGETHER are NOT sufficient."", ""correct"": false}]","Statement (1) provides the exact values of x and y, allowing for their sum to be calculated as 4. Statement (2) does not provide specific values for x and y, thus it is not sufficient on its own.","{""section"": ""Data Insights"", ""subsection"": ""Data Sufficiency"", ""topic"": ""Arithmetic DS"", ""subtopic"": ""Decimals (DS)""}",Hard,4.5,180
